<?xml version="1.0" encoding="UTF-8"?><?xml-stylesheet type="text/xsl" href="../../xsl/transversal/multiYearCalendar.xsl"?><calendar xmlns:xsi="http://www.w3.org/2001/XMLSchema-instance" xsi:noNamespaceSchemaLocation="../../xsd/transversal/multiYearCalendar.xsd">
    <ano value="2025">
        <month month_id="9" name="September">
            <day weekday="Monday" number="1">
                <workday/>
            </day>
            <day weekday="Tuesday" number="2">
                <workday/>
            </day>
            <day weekday="Wednesday" number="3">
                <workday/>
            </day>
            <day weekday="Thursday" number="4">
                <workday/>
            </day>
            <day weekday="Friday" number="5">
                <workday/>
            </day>
            <day weekday="Saturday" number="6">
                <weekend/>
            </day>
            <day weekday="Sunday" number="7">
                <weekend/>
            </day>
            <day weekday="Monday" number="8">
                <workday/>
            </day>
            <day weekday="Tuesday" number="9">
                <workday/>
            </day>
            <day weekday="Wednesday" number="10">
                <workday/>
            </day>
            <day weekday="Thursday" number="11">
                <workday/>
            </day>
            <day weekday="Friday" number="12">
                <workday/>
            </day>
            <day weekday="Saturday" number="13">
                <weekend/>
            </day>
            <day weekday="Sunday" number="14">
                <weekend/>
            </day>
            <day weekday="Monday" number="15">
                <workday/>
            </day>
            <day weekday="Tuesday" number="16">
                <workday/>
            </day>
            <day weekday="Wednesday" number="17">
                <workday/>
            </day>
            <day weekday="Thursday" number="18">
                <workday/>
            </day>
            <day weekday="Friday" number="19">
                <workday/>
            </day>
            <day weekday="Saturday" number="20">
                <weekend/>
            </day>
            <day weekday="Sunday" number="21">
                <weekend/>
            </day>
            <day weekday="Monday" number="22">
                <workday/>
            </day>
            <day weekday="Tuesday" number="23">
                <workday/>
            </day>
            <day weekday="Wednesday" number="24">
                <workday/>
            </day>
            <day weekday="Thursday" number="25">
                <workday/>
            </day>
            <day weekday="Friday" number="26">
                <workday/>
            </day>
            <day weekday="Saturday" number="27">
                <weekend/>
            </day>
            <day weekday="Sunday" number="28">
                <weekend/>
            </day>
            <day weekday="Monday" number="29">
                <workday/>
            </day>
            <day weekday="Tuesday" number="30">
                <workday/>
            </day>
        </month>
        <month month_id="10" name="October">
            <day weekday="Wednesday" number="1">
                <workday/>
            </day>
            <day weekday="Thursday" number="2">
                <workday/>
            </day>
            <day weekday="Friday" number="3">
                <workday/>
            </day>
            <day weekday="Saturday" number="4">
                <weekend/>
            </day>
            <day weekday="Sunday" number="5">
                <holiday>Republic Day</holiday>
            </day>
            <day weekday="Monday" number="6">
                <workday/>
            </day>
            <day weekday="Tuesday" number="7">
                <workday/>
            </day>
            <day weekday="Wednesday" number="8">
                <workday/>
            </day>
            <day weekday="Thursday" number="9">
                <workday/>
            </day>
            <day weekday="Friday" number="10">
                <workday/>
            </day>
            <day weekday="Saturday" number="11">
                <weekend/>
            </day>
            <day weekday="Sunday" number="12">
                <weekend/>
            </day>
            <day weekday="Monday" number="13">
                <workday/>
            </day>
            <day weekday="Tuesday" number="14">
                <workday/>
            </day>
            <day weekday="Wednesday" number="15">
                <workday/>
            </day>
            <day weekday="Thursday" number="16">
                <workday/>
            </day>
            <day weekday="Friday" number="17">
                <workday/>
            </day>
            <day weekday="Saturday" number="18">
                <weekend/>
            </day>
            <day weekday="Sunday" number="19">
                <weekend/>
            </day>
            <day weekday="Monday" number="20">
                <workday/>
            </day>
            <day weekday="Tuesday" number="21">
                <workday/>
            </day>
            <day weekday="Wednesday" number="22">
                <workday/>
            </day>
            <day weekday="Thursday" number="23">
                <workday/>
            </day>
            <day weekday="Friday" number="24">
                <workday/>
            </day>
            <day weekday="Saturday" number="25">
                <weekend/>
            </day>
            <day weekday="Sunday" number="26">
                <weekend/>
            </day>
            <day weekday="Monday" number="27">
                <workday/>
            </day>
            <day weekday="Tuesday" number="28">
                <workday/>
            </day>
            <day weekday="Wednesday" number="29">
                <workday/>
            </day>
            <day weekday="Thursday" number="30">
                <workday/>
            </day>
            <day weekday="Friday" number="31">
                <workday/>
            </day>
        </month>
        <month month_id="11" name="November">
            <day weekday="Saturday" number="1">
                <holiday>All Saints Day</holiday>
            </day>
            <day weekday="Sunday" number="2">
                <weekend/>
            </day>
            <day weekday="Monday" number="3">
                <workday/>
            </day>
            <day weekday="Tuesday" number="4">
                <workday/>
            </day>
            <day weekday="Wednesday" number="5">
                <workday/>
            </day>
            <day weekday="Thursday" number="6">
                <workday/>
            </day>
            <day weekday="Friday" number="7">
                <workday/>
            </day>
            <day weekday="Saturday" number="8">
                <weekend/>
            </day>
            <day weekday="Sunday" number="9">
                <weekend/>
            </day>
            <day weekday="Monday" number="10">
                <workday/>
            </day>
            <day weekday="Tuesday" number="11">
                <workday/>
            </day>
            <day weekday="Wednesday" number="12">
                <workday/>
            </day>
            <day weekday="Thursday" number="13">
                <workday/>
            </day>
            <day weekday="Friday" number="14">
                <workday/>
            </day>
            <day weekday="Saturday" number="15">
                <weekend/>
            </day>
            <day weekday="Sunday" number="16">
                <weekend/>
            </day>
            <day weekday="Monday" number="17">
                <workday/>
            </day>
            <day weekday="Tuesday" number="18">
                <workday/>
            </day>
            <day weekday="Wednesday" number="19">
                <workday/>
            </day>
            <day weekday="Thursday" number="20">
                <workday/>
            </day>
            <day weekday="Friday" number="21">
                <workday/>
            </day>
            <day weekday="Saturday" number="22">
                <weekend/>
            </day>
            <day weekday="Sunday" number="23">
                <weekend/>
            </day>
            <day weekday="Monday" number="24">
                <workday/>
            </day>
            <day weekday="Tuesday" number="25">
                <workday/>
            </day>
            <day weekday="Wednesday" number="26">
                <workday/>
            </day>
            <day weekday="Thursday" number="27">
                <workday/>
            </day>
            <day weekday="Friday" number="28">
                <workday/>
            </day>
            <day weekday="Saturday" number="29">
                <weekend/>
            </day>
            <day weekday="Sunday" number="30">
                <weekend/>
            </day>
        </month>
        <month month_id="12" name="December">
            <day weekday="Monday" number="1">
                <holiday>Restoration of Independence</holiday>
            </day>
            <day weekday="Tuesday" number="2">
                <workday/>
            </day>
            <day weekday="Wednesday" number="3">
                <workday/>
            </day>
            <day weekday="Thursday" number="4">
                <workday/>
            </day>
            <day weekday="Friday" number="5">
                <workday/>
            </day>
            <day weekday="Saturday" number="6">
                <weekend/>
            </day>
            <day weekday="Sunday" number="7">
                <weekend/>
            </day>
            <day weekday="Monday" number="8">
                <holiday>Immaculate Conception</holiday>
            </day>
            <day weekday="Tuesday" number="9">
                <workday/>